<?xml version="1.0" encoding="ISO-8859-1"?>
<!DOCTYPE coches SYSTEM "../../act2/concesionario_act2/concesionario.dtd">

<coches>
    <coche>
        <cod>C001</cod>
        <marca>Toyota</marca>
        <modelo>Corolla</modelo>
        <matricula>ABC123</matricula>
        <potencia>120</potencia>
        <plazas>5</plazas>
        <numPuertas>4</numPuertas>
    </coche>
    <coche>
        <cod>C002</cod>
        <marca>Ford</marca>
        <modelo>Focus</modelo>
        <matricula>XYZ789</matricula>
        <potencia>150</potencia>
        <plazas>5</plazas>
        <numPuertas>4</numPuertas>
    </coche>
    <coche>
        <cod>C003</cod>
        <marca>Chevrolet</marca>
        <modelo>Malibu</modelo>
        <matricula>DEF456</matricula>
        <potencia>140</potencia>
        <plazas>5</plazas>
        <numPuertas>4</numPuertas>
    </coche>
    <coche>
        <cod>C004</cod>
        <marca>Honda</marca>
        <modelo>Accord</modelo>
        <matricula>GHI789</matricula>
        <potencia>160</potencia>
        <plazas>5</plazas>
        <numPuertas>4</numPuertas>
    </coche>
    <coche>
        <cod>C005</cod>
        <marca>Volkswagen</marca>
        <modelo>Passat</modelo>
        <matricula>JKL012</matricula>
        <potencia>130</potencia>
        <plazas>5</plazas>
        <numPuertas>4</numPuertas>
    </coche>
    <coche>
        <cod>C006</cod>
        <marca>Hyundai</marca>
        <modelo>Elantra</modelo>
        <matricula>MNO345</matricula>
        <potencia>110</potencia>
        <plazas>5</plazas>
        <numPuertas>4</numPuertas>
    </coche>
    <coche>
        <cod>C007</cod>
        <marca>Nissan</marca>
        <modelo>Altima</modelo>
        <matricula>PQR678</matricula>
        <potencia>125</potencia>
        <plazas>5</plazas>
        <numPuertas>4</numPuertas>
    </coche>
    <coche>
        <cod>C008</cod>
        <marca>Mercedes-Benz</marca>
        <modelo>C-Class</modelo>
        <matricula>STU901</matricula>
        <potencia>180</potencia>
        <plazas>5</plazas>
        <numPuertas>4</numPuertas>
    </coche>
    <coche>
        <cod>C009</cod>
        <marca>Audi</marca>
        <modelo>A4</modelo>
        <matricula>VWX234</matricula>
        <potencia>170</potencia>
        <plazas>5</plazas>
        <numPuertas>4</numPuertas>
    </coche>
    <coche>
        <cod>C010</cod>
        <marca>BMW</marca>
        <modelo>3 Series</modelo>
        <matricula>YZA567</matricula>
        <potencia>190</potencia>
        <plazas>5</plazas>
        <numPuertas>4</numPuertas>
    </coche>
</coches>